{
  "analysisTaskId": "analysis-task-revenue-gap-q2",
  "cancelRequestedAt": null,
  "cancelledAt": null,
  "cancellingAt": null,
  "completedAt": null,
  "createdAt": "2026-06-05T11:08:00+08:00",
  "expiredAt": null,
  "failedAt": null,
  "failureCode": null,
  "originalRunId": null,
  "outcome": null,
  "phase": "intake",
  "queuedAt": null,
  "rejectedAt": null,
  "retryOfRunId": null,
  "retryable": true,
  "runId": "analysis-q2-revenue-gap",
  "startedAt": null,
  "status": "created",
  "terminalReason": null,
  "timeoutAt": null,
  "userId": "user-zoe",
  "validatingAt": null,
  "waitingFor": null,
  "waitingSince": null,
  "workspaceId": "workspace-northstar-retail-china"
}
